{
  "version": "1.0",
  "speaking_style": "energetic",
  "emotion": "excited",
  "pacing": "fast",
  "energy_curve": [
    { "t_ms": 0, "energy": 0.4 },
    { "t_ms": 1200, "energy": 0.8 },
    { "t_ms": 2400, "energy": 0.6 }
  ],
  "audience": "tech-savvy creators",
  "key_moments": [
    { "start_ms": 0, "end_ms": 1200, "label": "hook" }
  ],
  "recommended_style": "humorous_tech"
}
